{
  "registry_version": "v1.0",
  "generated_utc": "2026-01-17T15:25:26.154Z",
  "publisher": {
    "name": "AI Fiduciary Governance Certificationâ„¢",
    "disclaimer": "Registry confirms certification status only. It does not monitor operations and does not constitute legal advice, regulatory approval, or insurance coverage assurance. Certification applies only to the scope stated at issuance."
  },
  "entries": []
}
